{
  "schema": "open-music-taxonomy/taxonomy/0.1",
  "id": "open-music-taxonomy",
  "version": "0.4.0",
  "language": "en",
  "genres": [
    {
      "id": "metal",
      "label": "Metal",
      "status": "approved",
      "sonic_definition": "Riff-centered amplified music characterized by strongly distorted timbres, pronounced rhythmic weight, and performance vocabularies developed within Metal."
    },
    {
      "id": "rock",
      "label": "Rock",
      "status": "approved",
      "sonic_definition": "Amplified band music centered on rhythmic groove, a pronounced backbeat, and recurring guitar, bass, drum, and vocal song structures developed within Rock."
    },
    {
      "id": "metalcore",
      "label": "Metalcore",
      "status": "approved",
      "sonic_definition": "Heavy music combining Metal riff vocabulary with Hardcore-derived rhythmic structures, transitions, and breakdown-centered arrangements."
    },
    {
      "id": "deathcore",
      "label": "Deathcore",
      "status": "approved",
      "sonic_definition": "Heavy music combining Death Metal riffing and extreme-vocal vocabulary with breakdown-centered Core arrangements."
    },
    {
      "id": "hardcore",
      "label": "Hardcore",
      "status": "approved",
      "sonic_definition": "Punk-derived amplified music built around velocity, brevity, and beat-driven or breakdown-centered rhythmic structures developed within Hardcore."
    },
    {
      "id": "punk",
      "label": "Punk",
      "status": "approved",
      "sonic_definition": "High-energy amplified music built on tempo, downstroke guitar, direct vocal delivery, and anti-virtuosic brevity developed within Punk."
    },
    {
      "id": "grunge",
      "label": "Grunge",
      "status": "approved",
      "sonic_definition": "Rock combining heavy distorted guitar riffs, loud-quiet dynamic contrast, and introspective songwriting vocabularies developed within Grunge."
    },
    {
      "id": "numetal",
      "label": "Nu Metal",
      "status": "approved",
      "sonic_definition": "Metal combining down-tuned groove riffing with influences from Hip-Hop, Alternative Rock, and electronic production developed within Nu Metal."
    },
    {
      "id": "emoviolence",
      "label": "Emoviolence",
      "status": "approved",
      "sonic_definition": "Extreme music fusing Screamo-derived emotion and dissonance with Grindcore blast velocity and brevity, developed within Emoviolence."
    },
    {
      "id": "jazz",
      "label": "Jazz",
      "status": "approved",
      "sonic_definition": "Improvised music built on swing rhythm, blues-based harmony, and interactive ensemble improvisation, using the instrumental and vocal vocabularies developed within the Jazz tradition."
    },
    {
      "id": "traditionalpop",
      "label": "Traditional Pop",
      "status": "approved",
      "sonic_definition": "Mid-20th-century popular vocal music built on standard song form (the American Songbook), sung delivery, and orchestral or small-combo accompaniment, developed before and alongside Rock."
    },
    {
      "id": "electronic",
      "label": "Electronic",
      "status": "approved",
      "sonic_definition": "Music built primarily on electronically generated or sampled timbres, sequenced or programmed rhythm, and studio-as-instrument production, developed within Electronic music."
    }
  ],
  "types": [
    {
      "id": "metal.heavy",
      "label": "Heavy",
      "genre": "metal",
      "status": "approved",
      "sonic_definition": "Traditional Metal built around forceful guitar riffs, clear song forms, and predominantly melodic lead work and vocals."
    },
    {
      "id": "metal.death",
      "label": "Death",
      "genre": "metal",
      "status": "approved",
      "sonic_definition": "Metal using heavily distorted low-register riffing, extreme vocals, forceful percussion, and Death Metal rhythmic and harmonic vocabularies."
    },
    {
      "id": "metal.doom",
      "label": "Doom",
      "genre": "metal",
      "status": "approved",
      "sonic_definition": "Metal emphasizing slow or weighty pacing, sustained heavy riffs, and an oppressive or mournful harmonic character."
    },
    {
      "id": "metal.black",
      "label": "Black",
      "genre": "metal",
      "status": "approved",
      "sonic_definition": "Metal using Black Metal riffing, tremolo-centered textures, characteristic extreme vocals, and its established rhythmic and harmonic vocabulary."
    },
    {
      "id": "metal.thrash",
      "label": "Thrash",
      "genre": "metal",
      "status": "approved",
      "sonic_definition": "Metal emphasizing rapid palm-muted riffing, aggressive rhythmic attack, and tightly articulated high-energy arrangements."
    },
    {
      "id": "metal.power",
      "label": "Power",
      "genre": "metal",
      "status": "approved",
      "sonic_definition": "Metal emphasizing melodic lead work, driving rhythms, harmonized guitars, and expansive predominantly clean-vocal arrangements."
    },
    {
      "id": "metal.speed",
      "label": "Speed",
      "genre": "metal",
      "status": "approved",
      "sonic_definition": "Metal organized around sustained fast tempos and rapid riff articulation derived from early fast Heavy Metal."
    },
    {
      "id": "metal.gothic",
      "label": "Gothic",
      "genre": "metal",
      "status": "approved",
      "sonic_definition": "Metal using dark harmonic color, dramatic contrast, and established Gothic Metal vocal and arrangement vocabularies."
    },
    {
      "id": "metal.sludge",
      "label": "Sludge",
      "genre": "metal",
      "status": "approved",
      "sonic_definition": "Metal using abrasive low-register riffing, thick distorted timbres, and rhythmically forceful Sludge vocabulary."
    },
    {
      "id": "metal.industrial",
      "label": "Industrial",
      "genre": "metal",
      "status": "approved",
      "sonic_definition": "Metal structured around mechanical repetition, machine-like rhythm, and electronically processed or industrialized timbres."
    },
    {
      "id": "metal.groove",
      "label": "Groove",
      "genre": "metal",
      "status": "approved",
      "sonic_definition": "Metal emphasizing syncopated mid-tempo riff cycles, strong downbeat weight, and groove-centered rhythmic repetition."
    },
    {
      "id": "rock.hard",
      "label": "Hard",
      "genre": "rock",
      "status": "approved",
      "sonic_definition": "Rock emphasizing heavy guitar distortion, forceful drumming, and riff-driven arrangements while retaining Rock song vocabulary."
    },
    {
      "id": "rock.alternative",
      "label": "Alt.",
      "genre": "rock",
      "status": "approved",
      "sonic_definition": "Rock using the contrasting timbres, dynamics, and songwriting vocabularies established by Alternative Rock."
    },
    {
      "id": "rock.gothic",
      "label": "Gothic",
      "genre": "rock",
      "status": "approved",
      "sonic_definition": "Rock using dark post-punk-derived bass, guitar, vocal, and atmospheric vocabularies established by Gothic Rock."
    },
    {
      "id": "metal.post",
      "label": "Post",
      "genre": "metal",
      "status": "approved",
      "sonic_definition": "Metal that audibly moves beyond conventional Metal song forms through texture, development, and structural abstraction.",
      "join_next": "hyphen"
    },
    {
      "id": "rock.post",
      "label": "Post",
      "genre": "rock",
      "status": "approved",
      "sonic_definition": "Rock that audibly moves beyond conventional Rock song forms through texture, development, and structural abstraction.",
      "join_next": "hyphen"
    },
    {
      "id": "hardcore.post",
      "label": "Post",
      "genre": "hardcore",
      "status": "approved",
      "sonic_definition": "Hardcore that audibly moves beyond conventional Hardcore song forms through texture, development, and structural abstraction.",
      "join_next": "hyphen"
    },
    {
      "id": "jazz.vocal",
      "label": "Vocal",
      "genre": "jazz",
      "status": "approved",
      "sonic_definition": "Jazz centered on the vocal as the lead improvising voice, with jazz phrasing, diction, and repertoire."
    },
    {
      "id": "jazz.swing",
      "label": "Swing",
      "genre": "jazz",
      "status": "approved",
      "sonic_definition": "Jazz of the swing tradition built on a propulsive shuffle rhythm and arranged ensemble writing."
    },
    {
      "id": "jazz.bigband",
      "label": "Big Band",
      "genre": "jazz",
      "status": "approved",
      "sonic_definition": "Jazz for a large orchestrated ensemble of reeds, brass, and rhythm, emphasizing arranged sections interleaved with solos."
    },
    {
      "id": "jazz.soul",
      "label": "Soul",
      "genre": "jazz",
      "status": "approved",
      "sonic_definition": "Jazz built on bluesy grooves, repeating vamps, and gospel- and blues-derived vocabulary."
    },
    {
      "id": "electronic.house",
      "label": "House",
      "genre": "electronic",
      "status": "approved",
      "sonic_definition": "Electronic built on a four-on-the-floor kick, swung hi-hats, and repeating bass-and-riff grooves developed within House."
    },
    {
      "id": "electronic.techno",
      "label": "Techno",
      "genre": "electronic",
      "status": "approved",
      "sonic_definition": "Electronic built on machine-driven repetition, stark synthetic timbres, and a relentless groove developed within Techno."
    },
    {
      "id": "electronic.idm",
      "label": "IDM",
      "genre": "electronic",
      "status": "approved",
      "sonic_definition": "Electronic emphasizing intricate programmed rhythm, digital DSP, and headphone-oriented detail over dancefloor function."
    },
    {
      "id": "electronic.darkwave",
      "label": "Darkwave",
      "genre": "electronic",
      "status": "approved",